NAAM;RECHTSVORM;ADRES;POSTCODE;PLAATS;TRANSPORT MANAGER;VERGUNNING;GELDIG TOT;AANTAL;;
Wiegersma Grond- & Straatwerken B.V.;BV;Tussendiepen 67;9206 AC;DRACHTEN;R.  Wiegersma;EUR;30-04-20;1;;
Sake Zittema B.V.;BV;Orionweg 37;8938 AG;LEEUWARDEN;G.L.S.  Pot;NAT;;2;;
V.O.F. Fa. Reidinga;VOF;Sitadel 1;8491 AZ;AKKRUM;K.  Reidinga;NAT;;2;;
Visser Afvalverwerking Transport en Recycling B.V.;BV;Kelvinstraat 30;8861 ND;HARLINGEN;J.J.  Jilderts;NAT;;12;;
J.G. Niezen;Eenmanszaak;H.J. Kniggestraat 132;9501 NK;STADSKANAAL;J.G.  Niezen;NAT;;1;;
E. Hogenbirk, h.o.n. Transport- Zand- en Grinthandel E. Hogenbirk;Eenmanszaak;Barnar 28;7826 EV;EMMEN;E.  Hogenbirk;EUR;27-07-19;1;;
Transportbedrijf Hoiting B.V.;BV;Achter 't Hout 1;9461 TH;GIETEN;H.  Hoiting;EUR;12-04-19;12;;
A.J. van Deudekom B.V.;BV;Industrieweg 35;1115 AD;DUIVENDRECHT;J.M.A.  Deudekom;EUR;01-01-18;16;;
CE Special Courier B.V.;BV;Stettinweg 5;9723 HD;GRONINGEN;H. de Rijke;EUR;20-12-15;7;;
A. Stuulen, h.o.n. A.S.T. Emmen;Eenmanszaak;Zuidbargerstraat 82;7812 AJ;EMMEN;A.  Stuulen;EUR;19-07-15;1;;
Internationaal Transport Willem van der Endt C.V.;Commanditaire venn. met meerdere beh. vennoten;Volkerstraat 6;4462 GH;GOES;D. van der Endt;EUR;01-01-18;8;;
J. Smidts, h.o.n. De Vries en Zn.;Eenmanszaak;Rijksweg 11;8872 NT;MIDLUM;J.  Smidts;EUR;24-11-19;4;;
Crown Worldwide Transport B.V.;BV;Gyroscoopweg 19;1042 AC;AMSTERDAM;F.  Weijgertse;EUR;01-01-18;14;;
W. van Zanten, h.o.n. Transportbedrijf Wim van Zanten;Eenmanszaak;Lopsterweg 2;9921 RP;STEDUM;W. van Zanten;EUR;03-11-18;5;;
V.o.f. Oldenhuis-Westeremden;VOF;Bredeweg 13;9922 PD;WESTEREMDEN;A.  Oldenhuis;EUR;12-01-19;2;;
Verhagen B.V.;BV;Legmeerdijk 313;1431 GB;AALSMEER;R.G.M.  Verhagen;EUR;01-01-18;75;;
De Koeijer Transport B.V.;BV;Krab 8;4401 PA;YERSEKE;H.C. de Koeijer;EUR;01-01-18;56;;
Huisman Beheer Venhuizen B.V.;BV;Zuiderdijk 30;1606 MG;VENHUIZEN;B.H.  Huisman;NAT;;4;;
Klaas Bijlsma en Zonen B.V.;BV;Hemmemaweg 26;9076 PH;SINT ANNAPAROCHIE;J.K.  Bijlsma;NAT;;10;;
Melis Internationaal Transport B.V.;BV;Dijkgraaf 38 B;6921 RL;DUIVEN;M. R. M.  Melis;EUR;01-01-18;64;;
A.H. Boekema & Zn. V.o.f.;VOF;De Greiden 4;9003 MJ;WARTENA;A.H.  Boekema;EUR;18-11-18;10;;
V.o.f. Gebr. Dijkstra;VOF;Fzjentsjerterein 9 A;8855 HT;SEXBIERUM;I.  Dijkstra;EUR;30-11-15;2;;
Transportbedrijf Wiegmink B.V.;BV;Neushoornweg 27;8317 PV;KRAGGENBURG;F.  Wiegmink;EUR;25-05-19;11;;
Wegman Transport B.V.;BV;Handelsweg 9;9563 TS;TER APELKANAAL;H.  Wegman;EUR;14-09-19;30;;
Ter Wee B.V.;BV;Kerkeweg 69;8484 KB;LANGELILLE;G. ter Wee;NAT;;4;;
"V.o.f. Transportbedrijf, Mesthandel en Veevoeders ""Fa. P.J. Wassenaar & Zonen""";VOF;De Ofslach 1;9041 VA;BERLIKUM;J.  Wassenaar;EUR;12-03-17;10;;
V.o.f. Fa. J. v.d. Wal en Zn.;VOF;M. Beckstraat 51;9077 SG;VROUWENPAROCHIE;H.  Werkhoven-van der Wal;EUR;14-02-16;1;;
V.o.f. De Vries Transport;VOF;Herestraat 34;9851 AC;BURUM;W.I. de Vries;EUR;18-08-19;1;;
Transportbedrijf G.G. de Vries & Zoon B.V.;BV;Hermanawei 68 A;9047 JD;MINNERTSGA;G. de Vries;EUR;08-03-20;21;;
Transportbedrijf M.A. Verheijen B.V.;BV;Manegeweg 5;5916 NB;VENLO;T.M.J.  Verheijen -Hagens;EUR;01-01-18;8;;
V.o.f. De Vries Transport;VOF;K. Rienewerfstraat 6;9063 JT;MOLENEND;A. de Jong-de Vries;EUR;15-12-18;2;;
B.T. de Vries, h.o.n. Bart de Vries Transport Joure;Eenmanszaak;Firmawei 14;8501 XL;JOURE;B.T. de Vries;NAT;;2;;
Venema Marum B.V.;BV;Haarsterweg 6;9363 VD;MARUM;E.  Venema-Oosterhof;NAT;;1;;
Zeldenrust Transport B.V.;BV;Bloemakkers 5;9461 GX;GIETEN;S.  Zeldenrust;EUR;21-07-19;1;;
G.B. Wouda, h.o.n. Fa. T. Wouda en Zn.;Eenmanszaak;Gedempte Vaart 58;9231 AW;SURHUISTERVEEN;G.B.  Wouda;EUR;13-06-16;1;;
Transportbedrijf Wit V.o.f.;VOF;Huisweersterweg 2;9628 TS;SIDDEBUREN;K.  Wit;EUR;05-10-19;3;;
V.o.f. Fa. J. de Wit en Zonen;VOF;Dokterlaan 9;9686 PT;BEERTA;G.J. de Wit;EUR;18-12-16;2;;
V.o.f. Firma Van Wieren;VOF;Harlingertrekweg 86;8914 AV;LEEUWARDEN;K.J.  Pietersma;EUR;12-01-20;4;;
firma Gebrs. de Klerk;Eenmanszaak;Elektraweg 21;4338 PK;MIDDELBURG;T.J.A. de Klerk;EUR;01-01-18;6;;
K. Tijssen, h.o.n. Tijssen Internationaal Transport;Eenmanszaak;It Roer 7;9035 VR;DRONRIJP;K.  Tijssen;EUR;17-02-18;1;;
Trip-Popken B.V.;BV;Wiltonstraat 6;9403 AV;ASSEN;J  Popken;NAT;;4;;
J. van Opdorp en Zonen B.V.;BV;Nijverheidsstraat 2;4551 LA;SAS VAN GENT;H.C.  Hamelink;EUR;01-01-18;69;;
V.o.f. Snijder Transport, h.o.n. Snijder Transport Schildwolde;VOF;Hoofdweg 137;9626 AC;SCHILDWOLDE;M.  Snijder-Adams;NAT;;1;;
V.o.f. Fa. Sijbranda & Zn.;VOF;Jeltewei 234;8622 DC;HOMMERTS;L.  Sijbranda;NAT;;2;;
Stutvoet B.V.;BV;W.H. Bosgrastraat 64;9665 PG;OUDE PEKELA;J.J.H.  Stutvoet;EUR;15-09-18;16;;
Jappie Smids V.O.F.;VOF;Voorstraat 8;9291 CK;KOLLUM;J.  Smids;NAT;;2;;
LEHNKERING Chemical Transport B.V.;BV;Waalhaven O.z. 77;3087 BM;ROTTERDAM;M.M.O.L.  Terpstra-Koebrugge;EUR;01-01-18;43;;
Schans Transportbedrijf Beilen B.V.;BV;Torenlaan 38;9411 KE;BEILEN;J.  Schans;NAT;;2;;
J.A. Koopman, h.o.n. Transportbedrijf Koopman;Eenmanszaak;Henric de Cranestraat 42;8374 KP;KUINRE;J.A.  Koopman;EUR;29-11-15;1;;
A. Scheffers, h.o.n. Transportbedrijf Scheffers;Eenmanszaak;Eexterweg 10;9468 TH;ANNEN;A.  Scheffers;NAT;;1;;
A.J. de Ruiter, h.o.n. De Ruiter Handelsonderneming;Eenmanszaak;Overijsselsestraatweg 18;9008 TS;REDUZUM;A.J. de Ruiter;NAT;;2;;
Roelinga's Expeditie- en Grondbedrijf B.V.;BV;Hagewyk 49;9202 AJ;DRACHTEN;J.  Roelinga;NAT;;5;;
Reidinga Wegenbouwbedrijf B.V.;BV;De Dellen 43;9231 EA;SURHUISTERVEEN;J. van der Kooy;NAT;;1;;
Noordelijke Transport Maatschappij (N.T.M.) B.V.;BV;Schoolstraat 21;9781 JL;BEDUM;P.G.  Bronsema;EUR;20-07-17;5;;
Schenker Transport Groep B.V.;BV;Emma Goldmanweg 1;5032 MN;TILBURG;J.A.M.  Cleijsen;EUR;12-02-18;51;;
Transportbedrijf Haumann B.V.;BV;Halve Maan 5  A;5855 ED;WELL;O.F.W.  Peter;EUR;21-04-18;26;;
Rimatrans Nieuw-Weerdinge B.V.;BV;Vledderdiep 14;7831 TZ;NIEUW WEERDINGE;L.  Dol-Kiel;EUR;23-10-17;1;;
Poelman Zandhandel B.V.;BV;Scheiding 43 B;9865 VB;OPENDE;E.  Poelman;NAT;;10;;
A.P. Pilat, h.o.n. Fa. Pilat en Zn.;Eenmanszaak;Lagelandsterweg 115;9982 BE;UITHUIZERMEEDEN;A.P.  Pilat;NAT;;1;;
TNT Express Nederland B.V.;BV;Taurusavenue 111;2132 LS;HOOFDDORP;I.W.H.  Blanke;EUR;01-01-18;220;;
Transportbedrijf Mink B.V.;BV;Scharren 37;8517 HM;SCHARSTERBRUG;P.K.  Mink;EUR;18-12-17;5;;
Melkweg | Fritom B.V.;BV;De Wijmerts 7;8701 WT;BOLSWARD;J.  Breeuwsma;EUR;01-01-18;22;;
Walon B.V.;BV;Ramshoorn 4;4824 AG;BREDA;J.F.A.  Wesselman;EUR;01-01-18;40;;
Stummel Trans B.V.;BV;Woldstraat 14 04;7941 LJ;MEPPEL;A.  Stummel;EUR;22-03-20;2;;
M. Lamberts, h.o.n. Transportbedrijf Tinus Lamberts;Eenmanszaak;Annerweg 11;9471 KS;ZUIDLAREN;M.  Lamberts;NAT;;1;;
V.o.f. Transportbedrijf K. Lautenbag;VOF;Teeuwes de Boerstraat 42;8574 SC;BAKHUIZEN;J.  Lautenbag-Minnema;EUR;23-04-18;1;;
Zwatra B.V.;BV;Schieweg 14;2627 AN;DELFT;R.  Egas;EUR;01-01-18;56;;
J.H. Kootstra B.V.;BV;Bargerkampenweg 29;7812 BV;EMMEN;H.L.  Kootstra;EUR;01-01-18;4;;
Jac. Knol Transport en Materieel Verhuur B.V.;BV;It Patroan 5;8491 PK;AKKRUM;H.  Hartmans;EUR;22-03-20;6;;
Van der Wiel Transport B.V., h.o.n. KTF Transport;BV;Meerpaal 11;9206 AJ;DRACHTEN;K. van der Wiel;EUR;08-03-20;70;;
UTS Van den Berg Verhuizingen B.V.;BV;Takkebijsters 10;4817 BL;BREDA;A.P.  Meeus;EUR;01-01-18;4;;
Transportbedrijf Gebr. Kalk V.o.f. ;VOF; A. Einsteinlaan 35;9615 TE;KOLHAM;J.J. Kalk;NAT;;9;;
V.O.F.  Jonker Transport;VOF;Kwekersweg 16;9982 KA;UITHUIZERMEEDEN;H.  Jonker-Prins;EUR;08-03-20;2;;
V.o.f. Fa. H. Kamphuis en Zonen;VOF;Middenweg 63;9645 BB;VEENDAM;M.A.  Kamphuis-Grimmenga;EUR;02-06-18;6;;
V.O.F. De Jong & Romkema;VOF;Compagnonsfeart 43;8409 CS;HEMRIK;K. de Jong-Lenos;NAT;;1;;
Tj. de Jong;Eenmanszaak;Bewaarschoolstraat 13;8748 AN;WITMARSUM;T. de Jong;NAT;;1;;
W. de Jong, h.o.n. W. de Jong Transport;Eenmanszaak;Lustenburg 47;9283 TK;SURHUIZUM;W. de Jong;EUR;17-05-15;1;;
Antonisen Internationaal Transport B.V.;BV;Industrieweg 21;4731 SB;OUDENBOSCH;A.D.C.H.  Hopstaken;EUR;01-01-18;12;;
Transportbedrijf Hellinga V.o.f.;VOF;Rinia van Nautaweg 81;9061 AD;GYTSJERK;P.  Hellinga;EUR;16-01-19;3;;
Autotransport- en Garagebedrijf W. van der Meyden B.V.;BV;Hoogewaard 225;2396 AS;KOUDEKERK A/D RIJN;W. van der Meijden;EUR;01-01-18;30;;
J. Hartog, h.o.n. Transportbedrijf J. Hartog;Eenmanszaak;Pruimlaan 6;9917 PL;WIRDUM;J.  Hartog;EUR;01-01-18;1;;
Haarsma Transport B.V.;BV;Waltaweg 6;8765 LP;TJERKWERD;U.S.  Haarsma;EUR;17-02-18;7;;
Aannemersbedrijf Grashuis B.V.;BV;Boven Westerdiep 29;9641 LA;VEENDAM;A.M.  Grashuis;NAT;;1;;
V.o.f. Firma C. de Graaf en Zonen;VOF;Kruisstraat 14;7981 AR;DIEVER;C. de Graaf;EUR;03-11-18;2;;
V.o.f. Kelderhuis en Zn.;VOF;Middenweg 109;8538 RA;BANTEGA;J.A.C.M. de Kelderhuis-de Jong;EUR;02-06-18;3;;
V.O.F. L. Engels;VOF;Onstwedderweg 18;9663 BA;NIEUWE PEKELA;L.  Engels;NAT;;1;;
B.V. Vervoer en Autobedrijf Darvi;BV;Blankenweg 11;4612 RC;BERGEN OP ZOOM;A.P.  Meeus;EUR;01-01-18;82;;
E.S.F. de Letter B.V.;BV;Drieschouwen Zuid 27;4571 RV;AXEL;G.C.J. de Letter;EUR;01-01-18;3;;
V.o.f. Firma R.B. Danhof en Zoon;VOF;Emmastraat 11;9953 RA;BAFLO;H.  Danhof;EUR;13-12-15;1;;
J.H. Bruns, h.o.n. Transportbedrijf J.H. Bruns;Eenmanszaak;Mussel-A-Kanaal W.Z. 6;9584 TC;MUSSEL;J.H.  Bruns;EUR;14-04-19;1;;
Vermeire Transport B.V.;BV;Berlaersstraat 7;4576 AD;KOEWACHT;F.F.A.  Vermeire;EUR;01-01-18;7;;
H. Brolsma, h.o.n. Hans Brolsma;Eenmanszaak;Verlengde Stationsstraat 72;9271 CG;ZWAAGWESTEINDE;H.  Brolsma;EUR;26-03-17;2;;
Lau van Haren Logistics B.V.;BV;Metaalweg 15;6551 AC;WEURT;L.M.H.A. van Haren;EUR;01-01-18;2;;
V.o.f. Boersma;VOF;Lage Herenweg 2;9073 GB;MARRUM;J.  Boersma;EUR;09-02-20;2;;
Transportbedrijf Fa. Ugen B.V.;BV;Liesselseweg 120;5753 PP;DEURNE;R.A. van der Putten-Ugen;EUR;01-01-18;6;;
L. Bol, h.o.n. Bol Ten Boer;Eenmanszaak;Nijverheidsweg 3;9791 DA;TEN BOER;L.  Bol;NAT;;3;;
V.o.f. J. Ewals-Croonen;VOF;Stationsstraat 44;5935 RA;STEYL;J.H.J.  Ewals;EUR;12-04-19;2;;
J.A. Achterhof;Eenmanszaak;Hoofdweg 164;9626 AK;SCHILDWOLDE;J.A.  Achterhof;EUR;17-02-18;1;;
Exploitatiemaatschappij Meulenberg Urmond B.V.;BV;Paalweg 11;6129 EZ;URMOND;W.A.G.  Meulenberg;EUR;01-01-18;36;;
A. van der Beek, h.o.n. Transportbedrijf G. van der Beek;Eenmanszaak;Skrok 29;8918 LA;LEEUWARDEN;A. van der Beek;EUR;17-02-18;1;;
S. Banga, h.o.n. Banga Transport, Zand- en Grondhandel;Eenmanszaak;Triemsterloaene 5;9296 VA;TRIEMEN;S.  Banga;NAT;;1;;
Transportbedrijf en Handelsonderneming Bakker B.V.;BV;Overijsselsestraatweg 6  A;9008 TS;REDUZUM;W.F.  Janssen;EUR;10-10-17;7;;
A. Bakker, h.o.n. Bakker Transport;Eenmanszaak;Kollergang 10;6961 LZ;EERBEEK;A.  Bakker;EUR;08-03-20;3;;
V.o.f. Firma Andringa Transport;VOF;Buorren 64;9089 BL;WIJTGAARD;J.D.  Andringa;NAT;;1;;
P. Aalders;Eenmanszaak;Provincialeweg 14;9862 PE;SEBALDEBUREN;P.  Aalders;EUR;28-06-15;1;;
Transportbedrijf Aize Postmus V.o.f.;VOF;Knilles Wijtseswei 3;9262 NG;SUMAR;A.  Postmus;EUR;20-03-16;2;;
G. Aalderson en Zoon B.V.;BV;De Heersche 6;7547 RB;ENSCHEDE;P.  Aalderson;EUR;29-04-18;2;;
Albers Transport B.V.;BV;Leigraafseweg 1;6983 BR;DOESBURG;M.  Albers;EUR;05-10-19;31;;
Transportbedrijf W.H. Baars V.o.f.;VOF;Kerckhoveweg 16;6941 RH;DIDAM;L.T.G.  Baars-Polman;EUR;05-05-18;6;;
A.J. van Ballegooijen, h.o.n. Firma M.E. van Ballegooijen en Zonen;Eenmanszaak;Waaldijk 67;5327 AB;HURWENEN;H.H. van Ballegooyen-Van Gameren;EUR;25-10-15;1;;
Bent-ten Dolle B.V.;BV;Driemarkweg 12;7102 EX;WINTERSWIJK;B.H.  Bent;EUR;25-09-17;3;;
Sterenborg Transport V.o.f.;VOF;Hoofdkanaal WZ 28;7881 AB;EMMER COMPASCUUM;W.  Sterenborg;EUR;01-01-18;2;;
Beeren's Internationaal Transportbedrijf B.V.;BV;Marco Polo Weg 10;5928 LE;VENLO;L.M.  Beeren;EUR;01-01-18;42;;
Amerongen Kamphuis B.V.;BV;Ambachtsweg 15;3771 MG;BARNEVELD;J.  Kamphuis;EUR;01-01-18;69;;
B.V. Internationaal Transportbedrijf G.A. van Velthoven;BV;Bovendijk 30;2295 RZ;KWINTSHEUL;R.A.M. van Velthoven;EUR;01-01-18;52;;
Transportbedrijf Blotenburg B.V.;BV;Ruitenbeekweg 2 A;6741 HC;LUNTEREN;A.  Simonsz;NAT;;6;;
Boeve & Zn. V.o.f.;VOF;Zalkerdijk 41 A;8276 AB;ZALK;J.W.  Boeve;NAT;;1;;
Boonen Transport V.o.f.;VOF;Reling 75;3863 VB;NIJKERK;F.  Boonen;EUR;08-01-18;3;;
Koninklijke Meubeltransport Maatschappij De Gruyter en Co N.V.;Naamloze vennootschap gewone structuur;Industrieweg 11-13;2382 NR;ZOETERWOUDE;C.C.  Kiesewetter;EUR;01-01-18;11;;
J. Bos, h.o.n. R. Bos & Zonen;Eenmanszaak;Engelanderweg 13;7361 CT;BEEKBERGEN;J.  Bos;EUR;02-10-19;3;;
Bouwman Doorwerth B.V.;BV;De Overmaat 74;6831 AJ;ARNHEM;J.P.  Bensink;NAT;;1;;
Transportbedrijf H. ten Brinke en Zn. B.V.;BV;Morsweg 24;7461 AG;RIJSSEN;H. ten Brinke;EUR;03-02-18;16;;
Lock Transport B.V.;BV;Industriestraat 4 B;3371 XD;HARDINXVELD-GIESSENDAM;P.  Lock;EUR;01-01-18;33;;
R. van den Broek, h.o.n. Transportbedrijf R. van den Broek;Eenmanszaak;Strausslaan 96;3781 HS;VOORTHUIZEN;R. van den Broek;NAT;;1;;
J. van den Brom & Zonen B.V.;BV;Amersfoortseweg 148;3864 NH;NIJKERKERVEEN;M.  Priem;NAT;;4;;
Verhuur- en Transportbedrijf T. Brouwer V.o.f.;VOF;Sisalstraat 25;8281 JJ;GENEMUIDEN;L.J.  Bosch;NAT;;4;;
Brouwer Transport v.o.f.;VOF;Poppenallee 13;7722 KW;DALFSEN;W.  Brouwer;EUR;06-09-17;5;;
Transportbedrijf Bruco V.o.f.;VOF;Schoolweg 5;6991 EB;RHEDEN;A.  Bruger;EUR;23-02-20;1;;
Pax Dedicated Transport B.V.;BV;Telfordstraat 39;8013 RL;ZWOLLE;S.  Plantinga;EUR;01-01-18;23;;
V.o.f. Busscher-Weerselo;VOF;Bornsestraat 14;7595 LG;WEERSELO;H.J.C.  Busscher;NAT;;2;;
V.O.F. Busser Transport;VOF;IJsseldijk 32;7431 RE;DIEPENVEEN;J.  Busser;EUR;08-03-20;1;;
Transportbedrijf Coenders en Zonen Druten B.V., h.o.n. Hengelsteeg Transport;BV;Driesweg 1;6628 KB;ALTFORST;T.G.P.B.  Veens-Coenders;EUR;17-08-15;3;;
Transportbedrijf G.D. van Dalem V.o.f.;VOF;Ridder Alartlaan 30;4116 EJ;BUREN;G.D. van Dalem;EUR;12-01-20;1;;
Transportbedrijf Deuzeman V.o.f.;VOF;Schapendijk 4;7735 KV;ARRIEN;H.J.  Deuzeman;EUR;20-03-16;1;;
Van Dijk Transport B.V.;BV;Montagestraat 5;8263 BP;KAMPEN;D.G. van Dijk;EUR;16-06-18;9;;
Van Dijk Containers B.V.;BV;Sisalstraat 35;8281 JJ;GENEMUIDEN;T.H. van Dijk;EUR;31-03-19;10;;
V.o.f. Fa. L. van Dijk en Zn.;VOF;Lus 26;8281 NS;GENEMUIDEN;T. van Dijk;EUR;16-02-19;1;;
Bergtrans B.V.;BV;De Prinsenhof` 3;4004 LN;TIEL;H.M. van den Berg;EUR;01-01-18;10;;
V.o.f. Gebr. Van Dijk;VOF;Matensestraat  24;6669 CJ;DOEDEWAARD;J. van Dijk;EUR;17-02-18;3;;
H.H. Disbergen, h.o.n. Transportbedrijf E. Disbergen;Eenmanszaak;Breegraven 128;7231 JJ;WARNSVELD;H.H.  Disbergen;EUR;26-07-16;2;;
Jan de Rijk Benelux B.V.;BV;Leemstraat 15;4705 RT;ROOSENDAAL;J.G.M. de Rijk-Heeren;EUR;01-01-18;50;;
V.o.f. Van Echteld Transport;VOF;Zandstraat 143  A;6658 CS;BENEDEN-LEEUWEN;A.P.A. van Echteld;EUR;03-03-18;13;;
Dusseldorp Inzameling en Recycling B.V.;BV;Galileistraat 18;7131 PE;LICHTENVOORDE;M.R.  Holm;EUR;24-05-15;147;;
Snebo V.o.f.;VOF;Arnendijk 3;4641 PB;OSSENDRECHT;A.J.  Snepvangers;EUR;01-01-18;3;;
V.o.f. Firma Ennik;VOF;Kampweg 13;8316 AG;MARKNESSE;J.  Ennik;EUR;01-01-18;4;;
K.J.G. Engel, h.o.n. Engel Transportbedrijf Elburg;Eenmanszaak;Coragestraat 43;8081 XG;ELBURG;K.J.G.  Engel;EUR;27-12-15;3;;
V.o.f. Van Essen;VOF;Vinkekampweg 57;3774 PK;KOOTWIJKERBROEK;F.  Essen;EUR;29-11-15;3;;
Evers Transport V.o.f.;VOF;Meulunterseweg 86;6741 HP;LUNTEREN;R.M.G.  Evers;EUR;29-04-18;4;;
J. Faasse, h.o.n. Fabo Transport;Eenmanszaak;Vaartweg 118-120;8243 PP;LELYSTAD;J.  Faasse;NAT;;2;;
S. en T. de Geijter B.V.;BV;Watervalweg 137;3851 VB;ERMELO;A.  Beers-de Geijter;NAT;;2;;
G. de Greef en Zn. B.V.;BV;Oude Holleweg 59;3927 CK;RENSWOUDE;J. de Greef;EUR;01-01-18;12;;
Z.G. Goyer, h.o.n. Transportbedrijf George Goyer;Eenmanszaak;Hogeweg 9;6621 BM;DREUMEL;Z.G.  Goyer;EUR;23-07-18;4;;
Janssen Distribution Services B.V.;BV;Newtonweg 10;5928 PN;VENLO;C.J.A.M.  Jansen;EUR;01-01-18;84;;
Transportbedrijf Maters Huissen B.V.;BV;Nijverheidstraat 10;6851 EJ;HUISSEN;G.J.  Maters;EUR;01-01-18;93;;
V.O.F. van Haren;VOF;Rijnsteeg 74;6708 PK;WAGENINGEN;J.J. van Haren;NAT;;1;;
Hardeman Zand- en Grindhandel B.V.;BV;Middelbuurtseweg 47 A;3903 LB;VEENENDAAL;G.A.  Hardeman;EUR;05-07-15;4;;
Transportbedrijf J.M. Coenen Boxmeer B.V.;BV;Graafseweg 25;5831 AA;BOXMEER;T. G. M.  Coenen;EUR;01-01-18;19;;
Van Gansewinkel Transporten B.V.;BV;Den Engelsman 4;6026 RB;MAARHEEZE;J.A.T.  Hoogers;EUR;01-01-18;52;;
Transport- en Aannemingsbedrijf van Harten B.V.;BV;Neonstraat 20;6718 WV;EDE;L. van Harten;EUR;04-11-19;10;;
V.o.f. Fa. Heijman Melktransport;VOF;Bierkade 5;8356 DH;BLOKZIJL;L.H.M.  Heijman;NAT;;1;;
C.A.P. Arts, h.o.n. Arts en Zoon;Eenmanszaak;Lagelandseweg 36;6545 CE;NIJMEGEN;C.A.P.  Arts;EUR;01-01-18;3;;
V.o.f. Heite Melktransport;VOF;Kloosterweg 14;8326 CD;SINT JANSKLOOSTER;A.  Heite;NAT;;1;;
V.o.f. H. Heijting Angeren, h.o.n. H. Heijting Angeren Transport;VOF;Paddepoel 4;6687 LN;ANGEREN;M.J.M.  Heijting;EUR;03-03-18;11;;
Jacob Hissink Transport V.o.f.;VOF;Verzetsstraat 8;7396 CG;TERWOLDE;J.  Hissink;EUR;26-01-20;2;;
H. Hooijer, h.o.n. Henk Hooijer;Eenmanszaak;Harremaatweg 38;3781 NK;VOORTHUIZEN;H.  Hooijer;NAT;;1;;
Gist Nederland B.V.;BV;Klappolder 130;2665 LP;BLEISWIJK;K.  Brals;EUR;01-01-18;127;;
V.o.f. Hooijer;VOF;Harremaatweg 41;3781 NH;VOORTHUIZEN;A.E.H.  Hooijer;EUR;01-04-19;5;;
Transportbedrijf A. Huisman Ochten B.V., h.o.n. Transportbedrijf A. Huisman & Zn.;BV;Waalbandijk 57;4051 CK;OCHTEN;C.H.W.  Huisman;EUR;01-01-18;7;;
Huisman Transport B.V.;BV;Energieweg 1;6651 KT;DRUTEN;H.H.J.M.  Huisman;EUR;07-06-15;22;;
Jacobs Heteren B.V.;BV;Dorpsstraat 20;6666 AH;HETEREN;T.A.  Koopmans;EUR;01-09-18;8;;
Kelder's Transportonderneming B.V.;BV;Verlengde Stuwdijk 6;7784 DB;ANE;G.J.M.  Kelder;EUR;21-11-17;6;;
V.o.f. Jan Jansen Transport;VOF;Laakweg 54;7045 BG;AZEWIJN;L.J.M.A.  Jansen;EUR;28-06-15;7;;
Internationaal Transportbedrijf Janssen Landgraaf B.V.;BV;Europaweg 312;6374 KZ;LANDGRAAF;N.H.P.J.  Keerssemeeckers;EUR;01-01-18;27;;
H.G. Kettelarij, h.o.n. Kettelarij Transport;Eenmanszaak;Zutphenseweg 64;7245 NV;LAREN;H.G.  Kettelarij;EUR;18-08-19;2;;
L. Klein, h.o.n. L. Klein Transportbedrijf Elburg;Eenmanszaak;Klokbekerweg 96;8081 JH;ELBURG;L.  Klein;EUR;17-02-18;1;;
Kraanbedrijf Schiltmans Tiel B.V.;BV;Simon Stevinstraat 13;4004 JV;TIEL;A.J.C.M.  Schiltmans;NAT;;3;;
Van Kesteren Milieuservice B.V.;BV;Ambachtsweg 16;6562 AV;GROESBEEK;J.H.T. van Kesteren;EUR;01-01-18;14;;
V.o.f. W.J. Knol en Zn.;VOF;Hogeveldweg 123;7532 RP;ENSCHEDE;W.J.  Knol;NAT;;1;;
"Expeditie- en Transportonderneming  ""De Zwaluw"" C.V.";Commanditaire vennootschap met 1 beh. vennoot;Sleutelbloemstraat 21;7322 AJ;APELDOORN;B.J.  Vesterink-Jonker;NAT;;1;;
V.o.f. Transportbedrijf Joostema;VOF;Kloosterweg 6  A;8191 JB;WAPENVELD;M.J.  Joostema-Wittingen;EUR;02-04-18;4;;
V.o.f. Firma Gebroeders Bayense;VOF;Leutsestraat 8;5311 AA;GAMEREN;B.  Bayense;EUR;01-01-18;3;;
M. Raaijmakers en Zonen Expeditiebedrijf B.V.;BV;Sluitappel 23;5491 TS;SINT OEDENRODE;M.M.A.J.  Raaijmakers;EUR;01-01-18;20;;
V.o.f. Transportbedrijf B. Koopmans;VOF;Wagenweg 18;8374 ET;KUINRE;B.  Koopmans;EUR;05-07-15;4;;
V.o.f. B.J. Kramer;VOF;Griend  9;8321 MN;URK;E.P.  Kramer;NAT;;4;;
Albert Keijzer B.V.;BV;A. Keijzerstraat 1-4;1508 EZ;ZAANDAM;M. G. R. de Visser;EUR;01-01-18;151;;
Zijderhand Transport B.V.;BV;Weg en Land 10;2661 DB;BERGSCHENHOEK;M.M. van den Bogerd;EUR;01-01-18;42;;
Transport- en Aannemingsbedrijf B.J.A. Lesker B.V.;BV;Edisonstraat 3;7601 PS;ALMELO;E.B.H.  Lesker;EUR;14-02-16;8;;
Transportbedrijf Van Leusden B.V.;BV;Nude 1;6702 DH;WAGENINGEN;H.  Vink;EUR;16-09-18;22;;
A. van Looijengoed Transport B.V.;BV;Lageweg 46;3849 PE;HIERDEN;A.  Looijengoed;EUR;07-05-20;3;;
Grondverzetbedrijf Lokhorst B.V.;BV;Tongerenseweg Zuid 193;8162 SC;EPE;P.  Lokhorst;NAT;;4;;
G.H. van Maurik;Eenmanszaak;Brinkstraat 4 A;4033 CX;LIENDEN;G.H. van Maurik;NAT;;1;;
H.C. Zwiers, h.o.n. Erik Zwiers;Eenmanszaak;Marwijksoord 19;9448 XA;MARWIJKSOORD;H.C.  Zwiers;EUR;01-01-18;1;;
Merks Verhuur en Transport B.V.;BV;Wordenseweg 48;5334 JB;VELDDRIEL;G.L.H.M.  Merks;NAT;;1;;
Internationale Expeditieonderneming Coulance Amsterdam B.V.;BV;Stadionweg 121;1077 SK;AMSTERDAM;H.A.M.  Koenders;EUR;01-01-18;8;;
V.o.f. T. Middelkoop Expeditiebedrijf;VOF;Tiendweg 1;4152 GC;RHENOY;G.A.  Middelkoop;EUR;20-12-15;1;;
J.H. Meijers, h.o.n. J.H. Meijers Transport;Eenmanszaak;Kapweg 41;3774 RC;KOOTWIJKERBROEK;J.H.  Meijers;EUR;01-02-16;1;;
D. Meijer;Eenmanszaak;Weidehuisstraat 14;7771 WD;HARDENBERG;D.  Meijer;NAT;;1;;
Duiker Vervoer B.V.;BV;Westhavenweg 93;1042 BA;AMSTERDAM;H.  Duiker;EUR;01-01-18;16;;
A.V.B  Terbraak V.o.f.;VOF;Vredenseweg 125;7142 JA;GROENLO;R.J.M.  Terbraak;NAT;;1;;
Verduyn Group Nederland B.V.;BV;Rijnlanderweg 780;2132 NM;HOOFDDORP;A.J.  Verduijn;EUR;01-01-18;29;;
Weltens B.V. Internationale Transporten;BV;De Koumen 74;6433 KE;HOENSBROEK;P.R.G.H.  Hulsbosch;EUR;01-01-18;18;;
Internationale Transport en Verhuizingen H.J. Beck en Zn. B.V.;BV;Factorijweg 9;6541 DM;NIJMEGEN;W.H.L.J.  Beck;EUR;01-01-18;18;;
A. Nab;Eenmanszaak;Hogenkampweg 32;7255 JZ;HENGELO;A.  Nab;NAT;;1;;
R. Nab;Eenmanszaak;Bronsbergen 1;7207 AA;ZUTPHEN;R.  Nab;EUR;31-01-16;2;;
L.M.F. Teunissen, h.o.n. Teunissen Transport;Eenmanszaak;Tielsestraat 30;6675 AD;VALBURG;L.M.F.  Teunissen;EUR;01-05-16;1;;
Nienhuis Transport B.V.;BV;Flipsweg 13 A;7165 BL;RIETMOLEN;D.G.H.  Nienhuis;NAT;;10;;
V.o.f. Transportbedrijf Van der Moore;VOF;Margrietstraat 5  B;4175 GA;HAAFTEN;C.H. van der Moore;EUR;01-05-18;2;;
Keulen's Transport- en Grondverzetbedrijf B.V.;BV;Molenweg 25;6104 AH;KONINGSBOSCH;M.A.M.  Keulen;EUR;01-01-18;4;;
Transportbedrijf H. Oude Ophuis V.o.f.;VOF;Oranjestraat 36;7591 GB;DENEKAMP;A.M.  Oude Ophuis-Ditters;EUR;22-01-17;11;;
B.J.H. Oosterhout, h.o.n. Bas Oosterhout;Eenmanszaak;Nieuweweg 168;6603 BT;WIJCHEN;B.J.H.  Oosterhout;NAT;;1;;
Mus Transport B.V.;BV;Molenstraat 4;4171 CP;HERWIJNEN;E.G.  Mus;EUR;12-01-20;10;;
Transportbedrijf J. de Olde B.V.;BV;Kadoelen 24 A;8326 BB;SINT JANSKLOOSTER;P. de Olde;EUR;14-02-16;8;;
Olde Kalter Transport B.V.;BV;Beitelstraat 28;7556 NC;HENGELO;G.W.J.  Visscher;EUR;20-12-15;9;;
Noordendorp Transport B.V.;BV;Industriestraat 18;7482 EZ;HAAKSBERGEN;M.H.J.  Wentink;EUR;02-03-19;40;;
G.A. Timmer;Eenmanszaak;Prins Hendrikstraat 7;5308 JJ;AALST;G.A.  Timmer;NAT;;1;;
Internationaal Transportbedrijf W. Daemen B.V.;BV;Venloseweg 19;5993 PG;MAASBREE;W. B. M.  Daemen;EUR;01-01-18;11;;
V.o.f. Overmeen Transport Twello;VOF;Vivaldistraat 10;7391 ST;TWELLO;A.D.  Overmeen;EUR;05-10-19;5;;
Vos Logistics Ede B.V.;BV;Galvanistraat 100;6716 AE;EDE;W.  Roelofsen;EUR;01-01-18;1;;
V.o.f. Theo Peters en Zonen;VOF;Groenestraat 9;6681 DV;BEMMEL;H.A.T.  Peters;EUR;14-05-17;2;;
Transportbedrijf Pater & Zn. B.V.;BV;Dronkelaarseweg 29;3784 WB;TERSCHUUR;A.  Pater;NAT;;1;;
W.T. Roersen;Eenmanszaak;Steenbeek 26;3861 LH;NIJKERK;W.T.  Roersen;EUR;30-03-19;1;;
Tanke Transport B.V.;BV;ABC Westland 312;2685 DD;POELDIJK;W.F.M.  Tanke;EUR;01-01-18;20;;
B.V. Verhuis- en Transportbedrijf v/h H. Koenders en Zonen;BV;Churchilllaan 124;1078 EN;AMSTERDAM;H.J.M.  Koenders;EUR;20-12-15;6;;
Reductum B.V.;BV;Woudstraat 1;4031 JA;INGEN;K.  Dellebeke-den Boer;EUR;07-02-16;16;;
Radstaat Transporten V.O.F.;VOF;Berkenlaan 4 A;6721 CD;BENNEKOM;M.W.M.  Radstaat;EUR;16-08-15;5;;
A. Bernhard, h.o.n. Transport- en Verhuurbedrijf Bernard;Eenmanszaak;Oosterringweg 26;8315 PT;LUTTELGEEST;A.  Bernhard;NAT;;7;;
Internationaal Transport-, Expeditie- en Aannemersbedrijf M. Janssen en Zonen B.V.;BV;Kruisstraat 109;5935 RB;STEIJL;M.J.G.L.  Janssen;EUR;01-01-18;5;;
Internationaal Transportbedrijf en Kleiexploitatie H.J. Beaujean B.V.;BV;De Koumen 92;6433 KE;HOENSBROEK;H.G.M.J.  Beaujean;EUR;01-01-18;14;;
Otte Lisse B.V.;BV;Heereweg 1 B;2161 AB;LISSE;T.G.M.  Otte;NAT;;18;;
Bakker Bouwmaterialen V.o.f.;VOF;Hakstraat 5;8308 AH;NAGELE;W.  Bakker;NAT;;1;;
Schreuders Handel en Transport B.V.;BV;Weitjesweg 56;5306 XX;BRAKEL;M.J.E.  Schreuders-Duijzer;EUR;29-11-15;8;;
J.H.L. Slofstra, h.o.n. SLO-VA Transportbedrijf;Eenmanszaak;Van Leeuwenhoekstraat 15;3846 CA;HARDERWIJK;J.H.L.  Slofstra;EUR;26-01-20;7;;
Van 't Slot Transport V.o.f.;VOF;Molenweg 3;8075 PA;ELSPEET;A.G. van den Hardenberg-van 'tSlot;EUR;30-03-19;7;;
S.T.H.V. (Speciaal Transport Ter Horst Varsseveld) B.V.;BV;Aaltenseweg 58;7051 GV;VARSSEVELD;S. ter Horst;EUR;23-12-18;14;;
STTN V.o.f., h.o.n. Snellen Transport Tuinhout en Natuursteen;VOF;Postweg 207;6741 MK;LUNTEREN;G.  Snellen;EUR;12-05-19;5;;
Van Straaten Raalte B.V.;BV;Kaagstraat 20;8102 GZ;RAALTE;M.H.M. van Straaten;EUR;19-04-20;5;;
M.H.M. van Herwijnen;Eenmanszaak;Bulkseweg 26;5331 PK;KERKDRIEL;M.H.M. van Herwijnen;NAT;;1;;
V.o.f. Firma A. Sierink Transportbedrijf;VOF;Parallelweg 6;7772 SB;HARDENBERG;G.  Sierink;EUR;29-05-16;7;;
Oostvogels Transporten B.V.;BV;Hazeldonk 6252-6254;4836 LG;BREDA;E.J.C.  Oostvogels;EUR;01-01-18;52;;
Verhoeven Internationaal Transport B.V.;BV;Jagersveld 4;5405 BW;UDEN;M.P.M.  Bruijsten;EUR;01-01-18;43;;
V.O.F. Evert Uitslag Melktransport;VOF;Meeleweg 48;7711 EN;NIEUWLEUSEN;E.  Uitslag;NAT;;1;;
G.A. SernÇ Transport B.V.;BV;Laageinde 33;4191 NR;GELDERMALSEN;G.A.  Serne;EUR;17-03-18;1;;
Transportbedrijf Van de Swaluw B.V., h.o.n. Internationaal Transportbedrijf v.d. Swaluw;BV;Noordland 13;4451 RP;HEINKENSZAND;J.J. de Vos;EUR;01-01-18;27;;
V.o.f. Fa. Hesselman;VOF;Veldegge  7;7468 DJ;ENTER;H.M.E.A.  Freriksen-Hesselman;EUR;01-01-18;9;;
Van Hoek Verhuizingen B.V.;BV;Emdenweg 2;9723 TB;GRONINGEN;H.H.  Venhuizen;EUR;01-01-18;8;;
V.o.f. Firma Vonderman;VOF;Raalterstraat 64;8141 RM;HEINO;J.B.M.  Vonderman;EUR;16-08-15;4;;
V.o.f. Transportbedrijf Vos;VOF;Pannerdenseweg 105;6686 BD;DOORNENBURG;J.W.A.M  Vos;EUR;01-11-16;6;;
Roosendaal B.V.;BV;Verlaat 18;1601 JW;ENKHUIZEN;H.J.N. van den Berg;EUR;05-05-18;4;;
A. Verweij, h.o.n. A. Verweij Transport;Eenmanszaak;Donkerstraat 26;4119 LZ;RAVENSWAAIJ;A.  Verweij;EUR;10-10-19;1;;
Transportbedrijf Gebr. Verhoef B.V.;BV;Speulmanweg 15;4112 ND;BEUSICHEM;G.M.C.  Verhoef-Verkerk;EUR;23-08-15;6;;
E.W.A. Verhaar, h.o.n. Transportbedrijf Verhaar;Eenmanszaak;Schoresteynstraat 18;4158 DE;DEIL;E.W.A.  Verhaar;EUR;18-11-18;1;;
Internationaal Transportbedrijf Gosliga B.V.;BV;Rinia van Nautaweg 12;9061 AE;GYTSJERK;R.  Gosliga;EUR;01-01-18;28;;
Joh. Smit Transport B.V.;BV;Hoofdweg 137;9681 AD;MIDWOLDA;J.  Smit;EUR;01-01-18;15;;
